{
  "id": "ssq",
  "name": "双色球",
  "fullName": "中国福利彩票双色球",
  "category": "乐透型",
  "issueInterval": "twice_weekly",
  "pricePerBet": 2,
  "currency": "CNY",
  
  "zones": [
    {
      "name": "红球",
      "min": 1,
      "max": 33,
      "count": 6,
      "repeatable": false,
      "sorted": true,
      "color": "red",
      "allowExtra": true,
      "maxExtra": 20,
      "allowDanTuo": true
    },
    {
      "name": "蓝球",
      "min": 1,
      "max": 16,
      "count": 1,
      "repeatable": false,
      "sorted": false,
      "color": "blue",
      "allowExtra": true,
      "maxExtra": 16,
      "allowDanTuo": false
    }
  ],
  
  "prizes": [
    {
      "level": 1,
      "name": "一等奖",
      "matchPattern": [[6, 1]],
      "fixed": false,
      "poolRatio": 0.75,
      "maxPerTicket": 5000000
    },
    {
      "level": 2,
      "name": "二等奖",
      "matchPattern": [[6, 0]],
      "fixed": false,
      "poolRatio": 0.25,
      "maxPerTicket": 5000000
    },
    {
      "level": 3,
      "name": "三等奖",
      "matchPattern": [[5, 1]],
      "fixed": true,
      "amount": 3000
    },
    {
      "level": 4,
      "name": "四等奖",
      "matchPattern": [[5, 0], [4, 1]],
      "fixed": true,
      "amount": 200
    },
    {
      "level": 5,
      "name": "五等奖",
      "matchPattern": [[4, 0], [3, 1]],
      "fixed": true,
      "amount": 10
    },
    {
      "level": 6,
      "name": "六等奖",
      "matchPattern": [[0, 1], [1, 1], [2, 1]],
      "fixed": true,
      "amount": 5
    }
  ],
  
  "poolTiers": [
    {
      "min": 0,
      "max": 100000000,
      "firstPrizeRatio": 0.75,
      "secondPrizeRatio": 0.25,
      "secondPartRatio": null
    },
    {
      "min": 100000000,
      "max": null,
      "firstPrizeRatio": 0.75,
      "secondPrizeRatio": 0.25,
      "secondPartRatio": 0.15
    }
  ],
  
  "guaranteeRules": [
    {
      "level": 2,
      "condition": "min(6000)",
      "description": "二等奖单注不低于6000元"
    },
    {
      "level": 1,
      "condition": "min(prize2 * 2, 5000000)",
      "triggerLevel": 2,
      "cascade": true,
      "description": "一等奖不低于二等奖×2，封顶500万"
    }
  ],
  
  "canAddOn": false,
  "hasSpecialNumber": false,
  "hasReversePrize": false,
  
  "betType": {
    "singleRatio": 0.60,
    "complexRatio": 0.30,
    "danTuoRatio": 0.10,
    "complexRed7Ratio": 0.50,
    "complexRed8Ratio": 0.25,
    "complexRed9Ratio": 0.15,
    "complexRed10PlusRatio": 0.10,
    "dan1Tuo5Ratio": 0.70,
    "dan2Tuo4Ratio": 0.25,
    "dan3Tuo3Ratio": 0.05
  },
  
  "multiplier": {
    "ratio1x": 0.75,
    "ratio2_5x": 0.20,
    "ratio6_20x": 0.045,
    "ratio20xPlus": 0.005,
    "maxMultiplier": 100
  },
  
  "userBehavior": {
    "highFreqRatio": 0.12,
    "midFreqRatio": 0.38,
    "lowFreqRatio": 0.50,
    "randomSelectRatio": 0.30,
    "birthdaySelectRatio": 0.35,
    "trendSelectRatio": 0.25,
    "fixedSelectRatio": 0.10
  },
  
  "numberFeature": {
    "hotNumbers": [1, 5, 6, 8, 9, 11, 16, 19, 22, 28, 31],
    "coldNumbers": [3, 4, 7, 13, 24, 32, 33],
    "hotBonus": 0.10,
    "coldPenalty": 0.08,
    "birthdayRange": [1, 31],
    "zoneDistEven": 0.50,
    "zoneDistMild": 0.30,
    "zoneDistSevere": 0.18,
    "zoneDistEmpty": 0.02,
    "oddEvenBalanced": 0.70,
    "oddEvenSkewed": 0.25,
    "oddEvenExtreme": 0.05,
    "sumMiddleRatio": 0.70,
    "sumLowRatio": 0.15,
    "sumHighRatio": 0.15
  },
  
  "sales": {
    "baseSales": 10000,
    "fluctuation": 0.10,
    "trend": "stable",
    "trendRate": 0
  },
  
  "limits": {
    "maxBetsPerIssue": null,
    "maxAmountPerBet": 10000,
    "maxAmountPerIssue": 10000
  }
}
