{
  "id": "qxc",
  "name": "七星彩",
  "fullName": "中国体育彩票七星彩",
  "category": "数字型",
  "issueInterval": "thrice_weekly",
  "pricePerBet": 2,
  "currency": "CNY",
  
  "zones": [
    {
      "name": "第1位",
      "min": 0,
      "max": 9,
      "count": 1,
      "repeatable": true,
      "sorted": false
    },
    {
      "name": "第2位",
      "min": 0,
      "max": 9,
      "count": 1,
      "repeatable": true,
      "sorted": false
    },
    {
      "name": "第3位",
      "min": 0,
      "max": 9,
      "count": 1,
      "repeatable": true,
      "sorted": false
    },
    {
      "name": "第4位",
      "min": 0,
      "max": 9,
      "count": 1,
      "repeatable": true,
      "sorted": false
    },
    {
      "name": "第5位",
      "min": 0,
      "max": 9,
      "count": 1,
      "repeatable": true,
      "sorted": false
    },
    {
      "name": "第6位",
      "min": 0,
      "max": 9,
      "count": 1,
      "repeatable": true,
      "sorted": false
    },
    {
      "name": "第7位",
      "min": 0,
      "max": 9,
      "count": 1,
      "repeatable": true,
      "sorted": false
    }
  ],
  
  "prizes": [
    {
      "level": 1,
      "name": "一等奖",
      "matchPattern": [[1, 1, 1, 1, 1, 1, 1]],
      "fixed": false,
      "poolRatio": 0.90,
      "maxPerTicket": 5000000
    },
    {
      "level": 2,
      "name": "二等奖",
      "matchPattern": [[1, 1, 1, 1, 1, 1, 0]],
      "fixed": false,
      "poolRatio": 0.10,
      "maxPerTicket": 5000000
    },
    {
      "level": 3,
      "name": "三等奖",
      "matchPattern": [[1, 1, 1, 1, 1, 0, 0]],
      "fixed": true,
      "amount": 188
    },
    {
      "level": 4,
      "name": "四等奖",
      "matchPattern": [[1, 1, 1, 1, 0, 0, 0]],
      "fixed": true,
      "amount": 18
    },
    {
      "level": 5,
      "name": "五等奖",
      "matchPattern": [[1, 1, 1, 0, 0, 0, 0]],
      "fixed": true,
      "amount": 3
    }
  ],
  
  "poolTiers": [
    {
      "min": 0,
      "max": 300000000,
      "firstPrizeRatio": 0.90,
      "secondPrizeRatio": 0.10,
      "hasReverse": false
    },
    {
      "min": 300000000,
      "max": null,
      "firstPrizeRatio": 0.10,
      "secondPrizeRatio": 0.90,
      "hasReverse": true
    }
  ],
  
  "canAddOn": false,
  "hasSpecialNumber": false,
  "hasReversePrize": true,
  "reverseThreshold": 300000000,
  
  "betType": {
    "singleRatio": 0.70,
    "complexRatio": 0.30,
    "danTuoRatio": 0.00
  },
  
  "multiplier": {
    "ratio1x": 0.75,
    "ratio2_5x": 0.20,
    "ratio6_20x": 0.045,
    "ratio20xPlus": 0.005,
    "maxMultiplier": 100
  },
  
  "userBehavior": {
    "highFreqRatio": 0.08,
    "midFreqRatio": 0.37,
    "lowFreqRatio": 0.55
  },
  
  "sales": {
    "baseSales": 3000,
    "fluctuation": 0.12,
    "trend": "stable",
    "trendRate": 0
  },
  
  "limits": {
    "maxBetsPerIssue": null,
    "maxAmountPerBet": 10000,
    "maxAmountPerIssue": 10000
  }
}
